{
  "schema_version": 1,
  "result_source": "EXECUTED",
  "lifecycle_status": "CURRENT",
  "review_result": {
    "review_key": "review-v1:sha256:ffd4529f66192360ba438f0718a6da16cbbd15e3a912836dd46901d00ff1ab2c",
    "contract_digest": "contract-v1:sha256:8987fd3bc5224c00b46450e1c78580f6eccf86cb73fc21728d3b89d8526076e7",
    "review_scope": "FULL",
    "base_ref": "production",
    "head_ref": "deploy",
    "base_tip_commit": "1111111111111111111111111111111111111111",
    "merge_base": "1111111111111111111111111111111111111111",
    "parent_review_key": null,
    "previous_head": null,
    "current_head": "2222222222222222222222222222222222222222",
    "delta_changed_files": [],
    "contract": {
      "tool_version": "0.5.6",
      "result_schema_version": 8,
      "provider_output_schema": "sha256:47bc3df29c976c0f042a2aa49bd5216f0cf50f49f62e840a5c904383d30125e2",
      "prompt_contract_version": "2",
      "evaluation_rubric_version": "1.2.0",
      "provider_host": "codex",
      "model": "gpt-5.6-sol",
      "reasoning_effort": "max",
      "execution_profile": "production-ci"
    },
    "schema_version": 8,
    "evaluation_rubric_version": "1.2.0",
    "request": {
      "repository": "github.com/Fueav/code-quality",
      "target_branch": "production",
      "base_commit": "1111111111111111111111111111111111111111",
      "target_commit": "2222222222222222222222222222222222222222",
      "diff_selection_reason": "explicit_ref_range",
      "changed_files": ["main.go"],
      "affected_entries": []
    },
    "findings": [],
    "previous_blocking_findings": [],
    "previous_finding_resolutions": [],
    "new_findings": [],
    "execution": {
      "host": "codex",
      "review_mode": "native_review",
      "execution_profile": "production-ci",
      "model": "gpt-5.6-sol",
      "reasoning_effort": "max",
      "provider_invocations": 1,
      "adapter_drops": []
    },
    "adjudication": {
      "semantic_result": "PASS",
      "rollout_mode": "release_gate",
      "ci_action": "continue_release",
      "reasons": ["no P0/P1 blocking issue was reported"]
    }
  }
}
